{"type":"config","name":"ML2 CV Robust Generalization Search","metricName":"generalization_score","metricUnit":"","bestDirection":"higher"}
{"run":1,"commit":"0000000","metric":0,"metrics":{},"status":"crash","description":"Baseline failed before completion due to no space left on device while saving teacher logits cache.","timestamp":1777950138715,"segment":0,"confidence":null,"asi":{"hypothesis":"Run baseline candidate T=2 alpha=0.80 labeled=0.50 unlabeled=1.00 on exploration seeds 30-32.","error":"RuntimeError: No space left on device saving teacher logits cache","rollback_reason":"Benchmark infrastructure/storage failure, not recipe failure.","next_action_hint":"Inspect cache/disk usage and clean safe transient cache/log artifacts before re-running baseline."}}
{"run":2,"commit":"5f95c49","metric":0.82478782,"metrics":{"mean_val_acc":0.64661654,"cal_loss":1.21473078,"stress_mean":0.61487051,"stress_worst":0.55639098,"selected_epoch":75,"tau":1},"status":"keep","description":"Baseline repaired benchmark wrapper and ran T=2 alpha=0.80 labeled=0.50 unlabeled=1.00 on exploration folds.","timestamp":1777954321136,"segment":0,"confidence":null,"asi":{"hypothesis":"Baseline T=2 with strong unlabeled KD and moderate labeled KD should provide the incumbent robust generalization reference.","notes":"Recreated missing autoresearch_candidate.json and autoresearch_eval.py after crash cleanup; wrapper restores log.txt after benchmark."}}
{"run":3,"commit":"0000000","metric":0.81800101,"metrics":{"mean_val_acc":0.64411028,"cal_loss":1.23859991,"stress_mean":0.60456697,"stress_worst":0.54135338,"selected_epoch":75,"tau":1},"status":"discard","description":"T=1.5 sharper KD reduced robust generalization versus T=2 baseline.","timestamp":1777958530129,"segment":0,"confidence":null,"asi":{"hypothesis":"A lower KD temperature may sharpen teacher targets and improve transfer without class-specific tuning.","rollback_reason":"Primary generalization_score fell from 0.82478782 to 0.81800101, with worse stress_mean and stress_worst.","next_action_hint":"Avoid T=1.5 at alpha=0.80; try modestly higher T or adjust labeled KD weight globally."}}
{"run":4,"commit":"0000000","metric":0,"metrics":{"mean_val_acc":0,"cal_loss":0,"stress_mean":0,"stress_worst":0,"selected_epoch":0,"tau":0},"status":"crash","description":"T=2.5 candidate JSON syntax error before benchmark ran.","timestamp":1777958543433,"segment":0,"confidence":null,"asi":{"hypothesis":"A slightly softer KD temperature T=2.5 may improve robust transfer.","error":"JSONDecodeError: missing comma after description edit","rollback_reason":"Candidate file syntax error; no model training occurred.","next_action_hint":"Re-apply T=2.5 edit with valid JSON and rerun."}}
{"run":5,"commit":"0000000","metric":0.80242357,"metrics":{"mean_val_acc":0.63157895,"cal_loss":1.25845139,"stress_mean":0.59983292,"stress_worst":0.52631579,"selected_epoch":75,"tau":1},"status":"discard","description":"T=2.5 softer KD underperformed baseline across clean and stress metrics.","timestamp":1777962739347,"segment":0,"confidence":121.52805515404285,"asi":{"hypothesis":"A slightly softer KD temperature T=2.5 may improve robust teacher transfer.","rollback_reason":"Primary generalization_score dropped from 0.82478782 to 0.80242357; clean accuracy and stress worst both degraded materially.","next_action_hint":"Keep T=2.0 as the local temperature; explore alpha/labeled KD weights instead."}}
{"run":6,"commit":"0000000","metric":0,"metrics":{"mean_val_acc":0,"cal_loss":0,"stress_mean":0,"stress_worst":0,"selected_epoch":0,"tau":0},"status":"crash","description":"Alpha=0.75 candidate JSON syntax error before benchmark ran.","timestamp":1777962751644,"segment":0,"confidence":121.52805515404285,"asi":{"hypothesis":"Reducing alpha to 0.75 may balance hard-label supervision and KD transfer more robustly.","error":"JSONDecodeError: missing comma after description edit","rollback_reason":"Candidate file syntax error; no model training occurred.","next_action_hint":"Re-apply alpha=0.75 edit with valid JSON comma."}}
{"run":7,"commit":"14a8cc9","metric":0.82956244,"metrics":{"mean_val_acc":0.65162907,"cal_loss":1.24029776,"stress_mean":0.61375661,"stress_worst":0.56390977,"selected_epoch":75,"tau":1},"status":"keep","description":"Alpha=0.75 improved robust generalization with higher clean accuracy and stress worst at T=2.","timestamp":1777966958840,"segment":0,"confidence":143.50516155873473,"asi":{"hypothesis":"Reducing alpha to 0.75 balances hard-label supervision and KD transfer, improving generalization without class-specific tuning.","notes":"Improvement comes from clean accuracy and stress_worst despite slightly worse calibrated loss and flat stress_mean."}}
{"run":8,"commit":"791f4d1","metric":0.83049196,"metrics":{"mean_val_acc":0.65413534,"cal_loss":1.24922824,"stress_mean":0.61097187,"stress_worst":0.55639098,"selected_epoch":75,"tau":1},"status":"keep","description":"Alpha=0.70 gave a small further generalization gain at T=2 via higher clean accuracy.","timestamp":1777971174374,"segment":0,"confidence":145.59459620556095,"asi":{"hypothesis":"Further reducing alpha to 0.70 increases hard-label grounding while retaining enough KD signal for robust generalization.","notes":"Primary improved slightly over alpha=0.75 due to clean accuracy, but stress metrics regressed to roughly baseline; confirm cautiously before adopting."}}
{"type":"config","name":"ML2 CV Robust Generalization Search Continued","metricName":"generalization_score","metricUnit":"","bestDirection":"higher"}
{"run":9,"commit":"a1f3885","metric":0.83049196,"metrics":{"mean_val_acc":0.65413534,"cal_loss":1.24922824,"stress_mean":0.61097187,"stress_worst":0.55639098,"selected_epoch":75,"tau":1},"status":"keep","description":"Continued segment baseline: current best alpha=0.70 T=2 labeled=0.50 unlabeled=1.00.","timestamp":1777986799684,"segment":1,"confidence":null,"asi":{"hypothesis":"Re-establish current best previous-segment candidate as baseline before continuing search.","notes":"Deterministic rerun matched previous metric exactly."}}
{"run":10,"commit":"0000000","metric":0.79197542,"metrics":{"mean_val_acc":0.62155388,"cal_loss":1.28833447,"stress_mean":0.59092175,"stress_worst":0.54887218,"selected_epoch":75,"tau":1},"status":"discard","description":"Increasing labeled KD weight to 0.75 at alpha=0.70 harmed clean and stress generalization.","timestamp":1777990807673,"segment":1,"confidence":null,"asi":{"hypothesis":"A stronger global labeled KD term could improve teacher semantic transfer while retaining unlabeled KD.","rollback_reason":"Primary generalization_score dropped sharply from 0.83049196 to 0.79197542; clean accuracy fell over 3 points and calibrated loss worsened.","next_action_hint":"Do not increase labeled_kd_weight at alpha=0.70; if testing labeled KD, pair with alpha=0.75 or reduce unlabeled instead."}}
{"run":11,"commit":"0000000","metric":0.80941319,"metrics":{"mean_val_acc":0.63659148,"cal_loss":1.27144942,"stress_mean":0.60038986,"stress_worst":0.54887218,"selected_epoch":75,"tau":1},"status":"discard","description":"Reducing unlabeled KD weight to 0.75 at alpha=0.70 underperformed the current best.","timestamp":1777995263715,"segment":1,"confidence":null,"asi":{"hypothesis":"Reducing unlabeled KD could lessen teacher noise and improve hard-label grounding while retaining broad unlabeled signal.","rollback_reason":"Primary generalization_score fell from 0.83049196 to 0.80941319 with worse clean accuracy, loss, and stress metrics.","next_action_hint":"Keep unlabeled_kd_weight at 1.00 for alpha=0.70; the unlabeled teacher signal appears important."}}
{"run":12,"commit":"0000000","metric":0,"metrics":{"mean_val_acc":0,"cal_loss":0,"stress_mean":0,"stress_worst":0,"selected_epoch":0,"tau":0},"status":"crash","description":"Alpha=0.85 candidate timed out before producing metrics.","timestamp":1778024240146,"segment":1,"confidence":null,"asi":{"hypothesis":"Increasing alpha to 0.85 might improve robustness by leaning more on teacher KD at T=2.","error":"run_experiment timed out after extended runtime; only HF Hub unauthenticated warning was captured at tail.","rollback_reason":"No complete benchmark metrics were produced, so candidate cannot be evaluated.","next_action_hint":"Do not retry alpha=0.85 immediately; try lower-alpha neighborhood around the current best instead."}}
{"run":13,"commit":"0000000","metric":0.82442269,"metrics":{"mean_val_acc":0.64912281,"cal_loss":1.27517059,"stress_mean":0.6095795,"stress_worst":0.55639098,"selected_epoch":75,"tau":1},"status":"discard","description":"Alpha=0.65 reduced generalization versus alpha=0.70 current best.","timestamp":1778029784775,"segment":1,"confidence":null,"asi":{"hypothesis":"Continuing the lower-alpha trend from 0.80 to 0.70 could further improve hard-label grounding while retaining KD.","rollback_reason":"Primary generalization_score fell from 0.83049196 to 0.82442269, with lower clean accuracy and worse calibrated loss.","next_action_hint":"Alpha optimum on exploration seeds appears near 0.70-0.75; avoid going below 0.70 without other compensating changes."}}
{"run":14,"commit":"0000000","metric":0,"metrics":{"mean_val_acc":0,"cal_loss":0,"stress_mean":0,"stress_worst":0,"selected_epoch":0,"tau":0},"status":"crash","description":"Epoch=65 horizon test was aborted before producing metrics.","timestamp":1778031783989,"segment":1,"confidence":null,"asi":{"hypothesis":"A shorter 65-epoch student training horizon might improve robustness or loss versus the 75-epoch incumbent.","error":"run_experiment returned aborted before metrics were produced.","rollback_reason":"No complete benchmark metrics were produced, so the candidate cannot be evaluated.","next_action_hint":"Do not infer anything from this abort; prioritize alpha midpoint at epoch 75 per persisted research state."}}
{"run":15,"commit":"0000000","metric":0.80099436,"metrics":{"mean_val_acc":0.62907268,"cal_loss":1.2717464,"stress_mean":0.59593428,"stress_worst":0.54887218,"selected_epoch":75,"tau":1},"status":"discard","description":"Alpha midpoint 0.725 underperformed badly versus alpha=0.70/0.75 candidates.","timestamp":1778038887728,"segment":1,"confidence":null,"asi":{"hypothesis":"The optimum may lie between alpha=0.70 clean-favoring and alpha=0.75 stress_worst-favoring settings.","rollback_reason":"Primary generalization_score fell from 0.83049196 to 0.80099436, with materially worse clean accuracy and stress metrics.","next_action_hint":"Do not shave alpha midpoint further on these exploration seeds; next test reduced labeled KD while preserving full unlabeled KD."}}
{"run":16,"commit":"0000000","metric":0.82868282,"metrics":{"mean_val_acc":0.65413534,"cal_loss":1.18459069,"stress_mean":0.6095795,"stress_worst":0.52631579,"selected_epoch":75,"tau":1},"status":"discard","description":"Reduced labeled KD improved loss but hurt stress worst, below current best score.","timestamp":1778042783276,"segment":1,"confidence":null,"asi":{"hypothesis":"Reducing labeled teacher imitation while preserving full unlabeled KD may follow evidence that increasing labeled KD was harmful.","rollback_reason":"Primary generalization_score remained below incumbent 0.83049196 and stress_worst dropped substantially to 0.52631579 despite better raw loss.","next_action_hint":"Reduced labeled KD is not a score winner at alpha=0.70; test it once at alpha=0.75 only if prioritizing robustness/loss tradeoffs, otherwise move to epoch or small temperature nudges."}}
{"run":17,"commit":"0000000","metric":0.81637989,"metrics":{"mean_val_acc":0.64160401,"cal_loss":1.20352567,"stress_mean":0.60373155,"stress_worst":0.54135338,"selected_epoch":75,"tau":1},"status":"discard","description":"Reduced labeled KD at robust alpha=0.75 underperformed current best and original alpha=0.75.","timestamp":1778046654225,"segment":1,"confidence":null,"asi":{"hypothesis":"At alpha=0.75, reducing labeled KD might preserve the better stress_worst profile while improving hard-label grounding.","rollback_reason":"Primary generalization_score fell to 0.81637989 with lower clean accuracy and worse stress_worst than both incumbent and original alpha=0.75.","next_action_hint":"Stop labeled_kd_weight tuning; evidence supports keeping labeled=0.50 and unlabeled=1.00."}}
{"run":18,"commit":"0000000","metric":0.8118652,"metrics":{"mean_val_acc":0.63659148,"cal_loss":1.24355387,"stress_mean":0.60846561,"stress_worst":0.54887218,"selected_epoch":70,"tau":1},"status":"discard","description":"Epoch=70 training horizon underperformed the 75-epoch incumbent at alpha=0.70.","timestamp":1778050055041,"segment":1,"confidence":null,"asi":{"hypothesis":"A 70-epoch horizon might interpolate between possible shorter-training robustness and the 75-epoch incumbent.","rollback_reason":"Primary generalization_score fell from 0.83049196 to 0.81186520, with much lower clean accuracy and no stress compensation.","next_action_hint":"Keep epoch=75 as incumbent; do not pursue shorter horizon unless a true checkpoint-selection implementation is added."}}
{"run":19,"commit":"0000000","metric":0.82217761,"metrics":{"mean_val_acc":0.64661654,"cal_loss":1.24604307,"stress_mean":0.60651629,"stress_worst":0.55639098,"selected_epoch":75,"tau":1},"status":"discard","description":"T=1.75 lower-temperature nudge underperformed T=2 at alpha=0.70.","timestamp":1778053647547,"segment":1,"confidence":null,"asi":{"hypothesis":"With a less teacher-heavy alpha=0.70, a slightly sharper T=1.75 KD target might improve transfer versus T=2.","rollback_reason":"Primary generalization_score fell from 0.83049196 to 0.82217761, mostly due to lower clean accuracy and stress_mean.","next_action_hint":"Stop lower-temperature tuning; if using final budget, only test the symmetric small higher nudge T=2.25 or a safe wrapper override patch."}}
{"run":20,"commit":"0000000","metric":0.82919155,"metrics":{"mean_val_acc":0.65162907,"cal_loss":1.30742715,"stress_mean":0.6182122,"stress_worst":0.57142857,"selected_epoch":75,"tau":1},"status":"discard","description":"T=2.25 improved stress metrics but lost score and raw NLL versus T=2 incumbent.","timestamp":1778057235889,"segment":1,"confidence":null,"asi":{"hypothesis":"A slightly softer T=2.25 target near the alpha=0.70 winner might improve robustness without the broad T=2.5 degradation.","rollback_reason":"Primary generalization_score remained below incumbent 0.83049196 and cal_loss worsened by about 0.058, exceeding the near-tie acceptance rule despite better stress metrics.","next_action_hint":"Treat T=2.25 only as a robustness-profile observation, not a finalist under current scoring; freeze exploration or patch safe global overrides if starting a new segment."}}
{"type":"config","name":"ML2 CV Locked Confirmation Alpha 0.70 vs 0.75","metricName":"generalization_score","metricUnit":"","bestDirection":"higher"}
{"run":21,"commit":"f332ce2","metric":0.82871092,"metrics":{"mean_val_acc":0.65670996,"cal_loss":1.14543163,"stress_mean":0.61974507,"stress_worst":0.48051948,"selected_epoch":75,"tau":1},"status":"keep","description":"LOCKED confirmation baseline alpha=0.70 on seeds 40-44.","timestamp":1778087285739,"segment":2,"confidence":null,"asi":{"hypothesis":"Confirm whether exploration scalar incumbent alpha=0.70 generalizes to locked seeds 40-44 before comparing the alpha=0.75 robustness finalist.","notes":"This is the locked-seed baseline; do not add new challengers based on this result."}}
{"run":22,"commit":"0000000","metric":0.81530544,"metrics":{"mean_val_acc":0.64177489,"cal_loss":1.16240631,"stress_mean":0.60791246,"stress_worst":0.51948052,"selected_epoch":75,"tau":1},"status":"discard","description":"LOCKED alpha=0.75 robustness finalist lost substantial scalar/clean accuracy versus alpha=0.70.","timestamp":1778093473610,"segment":2,"confidence":null,"asi":{"hypothesis":"Confirm whether alpha=0.75's exploration robustness profile generalizes better than alpha=0.70 on locked seeds 40-44.","rollback_reason":"Locked primary generalization_score was 0.81530544 versus alpha=0.70 baseline 0.82871092; mean clean accuracy and stress_mean were also worse. Alpha=0.75 did improve stress_worst, but not enough to satisfy the predeclared near-tie robustness rule.","next_action_hint":"Freeze locked comparison; do not add challengers. Prefer alpha=0.70 unless a manual per-seed audit reveals unacceptable worst-seed/stress behavior."}}
{"run":23,"commit":"0000000","metric":0,"metrics":{"mean_val_acc":0,"cal_loss":0,"stress_mean":0,"stress_worst":0,"selected_epoch":0,"tau":0},"status":"crash","description":"User-interrupted rerun of locked alpha=0.70 incumbent; no new evidence.","timestamp":1778095205544,"segment":2,"confidence":null,"asi":{"hypothesis":"Accidental next iteration reran the locked alpha=0.70 incumbent on seeds 40-44.","error":"run_experiment returned aborted before metrics were produced.","rollback_reason":"No complete benchmark metrics; repeated locked-seed reruns should be avoided to prevent overfitting/confirmation leakage.","next_action_hint":"Do not run more locked confirmation iterations; if optimizing runtime, start a separate profiling/throughput segment with metrics-preserving infrastructure changes only."}}
{"type":"config","name":"ML2 CV Runtime Speedups for Frozen Locked Recipe","metricName":"wall_seconds","metricUnit":"s","bestDirection":"lower"}
{"run":24,"commit":"5e3e21a","metric":6467.5,"metrics":{"generalization_score":0.82997595,"mean_val_acc":0.65411255,"cal_loss":1.15116179,"stress_mean":0.61957672,"stress_worst":0.51948052,"selected_epoch":75,"tau":1},"status":"keep","description":"Batched teacher TTA views into one forward pass for faster frozen-recipe benchmark.","timestamp":1778101772846,"segment":3,"confidence":null,"asi":{"hypothesis":"Batching the five teacher TTA views into a single larger forward pass preserves semantics while reducing teacher logit-collection wall time for the frozen alpha=0.70 recipe.","runtime_baseline_seconds_from_locked_run21":8237.6,"runtime_seconds":6467.5,"estimated_speedup_percent":21.49,"notes":"This is a runtime/infrastructure segment, not additional recipe selection. The repeated locked generalization metrics should not be used to add challengers or tune the model; the recipe remains frozen at T=2 alpha=0.70 labeled=0.50 unlabeled=1.00 epoch=75."}}
{"type":"config","name":"ML2 CV MaxViT KD Transfer Search","metricName":"generalization_score","metricUnit":"","bestDirection":"higher"}
{"type":"config","name":"ML2 CV MaxViT KD Transfer Search","metricName":"generalization_score","metricUnit":"","bestDirection":"higher"}
{"run":25,"commit":"0000000","metric":0,"metrics":{"mean_val_acc":0,"cal_loss":0,"stress_mean":0,"stress_worst":0,"selected_epoch":0,"tau":0},"status":"crash","description":"MaxViT baseline crashed because teacher fine-tune train split was empty.","timestamp":1778136266311,"segment":5,"confidence":null,"asi":{"hypothesis":"Baseline MaxViT staged teacher with softer KD (T=4 alpha=0.50 unlabeled=0.50) should reduce overconfident teacher pressure versus initial MaxViT grid.","error":"ValueError: num_samples should be a positive integer value, got num_samples=0 while creating teacher train DataLoader.","rollback_reason":"Benchmark infrastructure/data-split failure; no student metrics produced.","next_action_hint":"Inspect autoresearch_eval/run_kd_cv configuration and data path handling to ensure seed-30 teacher fine-tune has nonempty labeled training data before rerunning."}}
{"run":26,"commit":"0000000","metric":0,"metrics":{"mean_val_acc":0.58441558,"cal_loss":1.29945056,"stress_mean":0.55266955,"stress_worst":0.51948052,"selected_epoch":31,"tau":1},"status":"crash","description":"Single-seed MaxViT benchmark completed training but crashed while normalizing kd_validation_run metrics.","timestamp":1778140871327,"segment":5,"confidence":null,"asi":{"hypothesis":"Fixing the wrapper to use split-validation KD for seeds=1 should allow the intended MaxViT single-seed triage baseline to run.","error":"autoresearch_eval expected mean_val_acc from kd_cv_run, but run_kd produced kd_validation_run with best_val_acc/best_val_loss fields.","observed_candidate_score_if_normalized":0.74391457,"rollback_reason":"Benchmark wrapper metric-normalization bug; METRIC lines were not emitted despite completed training.","next_action_hint":"Normalize kd_validation_run best_val_acc/best_val_loss to the same scalar interface, then rerun or use as a known weak baseline reference."}}
{"run":27,"commit":"41c92c7","metric":0.74391403,"metrics":{"mean_val_acc":0.58441558,"cal_loss":1.29945056,"stress_mean":0.55266955,"stress_worst":0.51948052,"selected_epoch":31,"tau":1},"status":"keep","description":"MaxViT single-seed baseline with T=4 alpha=0.50 unlabeled=0.50 and wrapper support for seeds=1 triage.","timestamp":1778145317703,"segment":5,"confidence":null,"asi":{"hypothesis":"Reducing unlabeled MaxViT KD pressure to 0.50 and using softer T=4 alpha=0.50 should mitigate overconfident teacher transfer relative to the initial MaxViT grid.","notes":"This establishes the new MaxViT-transfer segment baseline and fixes the benchmark wrapper so seeds=1 uses split-validation KD instead of invalid one-fold CV. The baseline is weak versus prior B0 profile, so subsequent tests should seek large gains."}}
